{
  "meta": {"service": "visualisation-service", "date": "2026-01-27", "phase": "TDD_RED", "from_agent": "@functional-tester", "to_agent": "@python-coder"},
  "summary": "TDD RED complete: 118 failing tests for vis-service. Ready for implementation.",
  "tasks_completed": [
    {"id": "VS-001", "name": "Bollinger calculator tests", "status": "complete", "tests": 20},
    {"id": "VS-002", "name": "Signal detector tests", "status": "complete", "tests": 15},
    {"id": "VS-003", "name": "Strategy registry tests", "status": "complete", "tests": 19},
    {"id": "VS-004", "name": "Backtest engine tests", "status": "complete", "tests": 24},
    {"id": "VS-006", "name": "Config storage tests", "status": "complete", "tests": 21},
    {"id": "VS-008", "name": "Export tests", "status": "complete", "tests": 19}
  ],
  "next_tasks": [
    {"id": "VS-101", "name": "Create project structure"},
    {"id": "VS-102", "name": "Implement Bollinger calculator"},
    {"id": "VS-103", "name": "Implement signal detector"},
    {"id": "VS-104", "name": "Implement strategy registry"},
    {"id": "VS-105", "name": "Implement backtest engine"},
    {"id": "VS-106", "name": "Implement metrics calculator"},
    {"id": "VS-107", "name": "Implement config storage"},
    {"id": "VS-109", "name": "Implement CSV exporter"},
    {"id": "VS-110", "name": "Implement Parquet exporter"}
  ],
  "status": "ready",
  "blockers": [],
  "artifacts": {"tests": "services/visualisation-service/tests/"},
  "stats": {"total_tests": 118, "tests_failing": 118},
  "context": {
    "architecture_ref": "artifacts/architecture/architecture.md",
    "key_decisions": ["Tests FAIL until implementation", "Use bollinger_types for shared models", "Implement: calculators -> storage -> endpoints"]
  }
}
